{
 "format": "pdb",
 "coordinate_units": "angstrom",
 "model_count": 1,
 "chain_count": 2,
 "residue_count": 3,
 "atom_count": 4,
 "polymer_atom_count": 3,
 "hetero_atom_count": 1,
 "element_counts": {
  "C": 1,
  "N": 2,
  "O": 1
 },
 "bounds": {
  "min": {
   "x": 11.104,
   "y": 13.207,
   "z": 7.657
  },
  "max": {
   "x": 14.104,
   "y": 15.207,
   "z": 9.657
  },
  "center": {
   "x": 12.604,
   "y": 14.207,
   "z": 8.657
  },
  "span": {
   "x": 3.0,
   "y": 2.0,
   "z": 2.0
  }
 },
 "b_factor_summary": {
  "count": 4,
  "min": 20.0,
  "max": 95.0,
  "mean": 63.75
 },
 "alphafold_confidence": {
  "source": "pdb-b-factor-explicit",
  "residue_count": 2,
  "min_plddt": 45.0,
  "max_plddt": 95.0,
  "mean_plddt": 70.0,
  "bands": {
   "very_high_count": 1,
   "confident_count": 0,
   "low_count": 0,
   "very_low_count": 1
  }
 },
 "models": [
  {
   "model_id": "1",
   "atom_count": 4,
   "residue_count": 3,
   "chains": [
    {
     "chain_id": "A",
     "atom_count": 3,
     "residue_count": 2,
     "polymer_residue_count": 2,
     "hetero_residue_count": 0
    },
    {
     "chain_id": "B",
     "atom_count": 1,
     "residue_count": 1,
     "polymer_residue_count": 0,
     "hetero_residue_count": 1
    }
   ]
  }
 ],
 "residues": [
  {
   "index": 0,
   "model_id": "1",
   "chain_id": "A",
   "sequence_number": "1",
   "insertion_code": null,
   "name": "GLY",
   "is_hetero": false,
   "atom_count": 2,
   "plddt": 95.0
  },
  {
   "index": 1,
   "model_id": "1",
   "chain_id": "A",
   "sequence_number": "2",
   "insertion_code": null,
   "name": "ALA",
   "is_hetero": false,
   "atom_count": 1,
   "plddt": 45.0
  },
  {
   "index": 2,
   "model_id": "1",
   "chain_id": "B",
   "sequence_number": "101",
   "insertion_code": null,
   "name": "HOH",
   "is_hetero": true,
   "atom_count": 1,
   "plddt": null
  }
 ],
 "atoms": [
  {
   "index": 0,
   "serial": "1",
   "record": "atom",
   "model_id": "1",
   "residue_index": 0,
   "name": "N",
   "alternate_location": null,
   "residue_name": "GLY",
   "chain_id": "A",
   "residue_sequence_number": "1",
   "insertion_code": null,
   "position": {
    "x": 11.104,
    "y": 13.207,
    "z": 9.657
   },
   "occupancy": 1.0,
   "b_factor": 95.0,
   "element": "N",
   "formal_charge": null
  },
  {
   "index": 1,
   "serial": "2",
   "record": "atom",
   "model_id": "1",
   "residue_index": 0,
   "name": "CA",
   "alternate_location": null,
   "residue_name": "GLY",
   "chain_id": "A",
   "residue_sequence_number": "1",
   "insertion_code": null,
   "position": {
    "x": 12.204,
    "y": 13.707,
    "z": 9.157
   },
   "occupancy": 1.0,
   "b_factor": 95.0,
   "element": "C",
   "formal_charge": null
  },
  {
   "index": 2,
   "serial": "3",
   "record": "atom",
   "model_id": "1",
   "residue_index": 1,
   "name": "N",
   "alternate_location": null,
   "residue_name": "ALA",
   "chain_id": "A",
   "residue_sequence_number": "2",
   "insertion_code": null,
   "position": {
    "x": 13.104,
    "y": 14.207,
    "z": 8.657
   },
   "occupancy": 1.0,
   "b_factor": 45.0,
   "element": "N",
   "formal_charge": null
  },
  {
   "index": 3,
   "serial": "4",
   "record": "hetatm",
   "model_id": "1",
   "residue_index": 2,
   "name": "O",
   "alternate_location": null,
   "residue_name": "HOH",
   "chain_id": "B",
   "residue_sequence_number": "101",
   "insertion_code": null,
   "position": {
    "x": 14.104,
    "y": 15.207,
    "z": 7.657
   },
   "occupancy": 1.0,
   "b_factor": 20.0,
   "element": "O",
   "formal_charge": null
  }
 ],
 "warnings": [
  "B-factor values were interpreted as AlphaFold pLDDT because the caller explicitly requested it; PDB content alone does not establish AlphaFold provenance"
 ]
}
